title,url,price,avg_review,num_reviews,desc_text,desc_list,prod_category
"TSV Crossbody Cell Phone Purse Bag, Leather Phone Case Holder Wallet with Touch Window, Small Lightweight Shoulder Bag Crossbody Bag Coin Purse Credit Card Holder, Fits for iPhone Xs Max and more",https://www.walmart.com/ip/TSV-Crossbody-Cell-Phone-Purse-Bag-Leather-Case-Holder-Wallet-Touch-Window-Small-Lightweight-Shoulder-Bag-Coin-Credit-Card-Holder-Fits-iPhone-Xs-Max/104247906?variantFieldId=actual_color,7.97,,0, WOWParts team offers 30 days return or replacement quality warranty & lifetime technical supports. Please contact us freely if you need anyfurhter assistance. ,"Protections: Made of PU leather, this phone purse keeps your cellphone and other electric devices safe and protected.,Compatible: Compatible with iPhone 11, iPhone X, iPhone 8, iPhone 7, iPhone6, iPhone5/5s; Samsung Galaxy Note5; Samsung Galaxy S7/S6/S5; HTC and any other mobile phone under 6.5 inch.,Design: Two separated pouches, not only hold your smartphone, but also some cash, credit cards, keys, charger, earphones, etc. An open pocket on back can hold some cash or cards.,Applications: The bag with cute appearance is perfect for use in any occasions. Tiny simple design and lightweight shoulder bag suits any style handbag, clothes, etc.,Type: Pouch,Gender: Women,Material: PU Leather,Shoulder Belt Length: 119.5cm/47in,Applicable Mobile Phone: ≤ 6.5in,Closure Type: Hasp ,Size: 19.5cm*12cm*2cm/7.68*4.72*0.79in,1 x Phone Purse,Full protection: Made of PU leather, prevents cellphone and other electric devices from dust, shocks, scratches. ,Convenient Carrying: 1 clear phone pocket & 1 slip pocket. ,DIY Length: Easy to unlash the strap, make a knot to adjust the length of strap. ,Good Purposes: Directly use the smartphone by the clear touchscreen window. ,Various Phone Size: Compatible with iPhone; Samsung Galaxy; HTC and more phone under 6.5 inch.",Cell Phones
"TSV Small Crossbody Bag Cell Phone Purse, PU Leather Cellphone Bag Wallet with Credit Card Slots for Women, Mini Shoulder Bag Messenger Pouch Ladies Handbag Clutch Phone Pockets",https://www.walmart.com/ip/TSV-Small-Crossbody-Bag-Cell-Phone-Purse-PU-Leather-Cellphone-Wallet-Credit-Card-Slots-Women-Mini-Shoulder-Messenger-Pouch-Ladies-Handbag-Clutch-Pock/388836329?variantFieldId=actual_color,13.97,,0,,,Clothing
"TSV 13/15.6 Inch Laptop Sleeve Case Protective Cover Compatible with MacBook Air/Pro13.3"", HP laptop 15.6"" Acer Asus Samsung Toshiba HP Chromebook WaterProof Protective Notebook Tablet Bag",https://www.walmart.com/ip/TSV-13-15-6-Inch-Laptop-Sleeve-Case-Protective-Cover-Compatible-MacBook-Air-Pro13-3-HP-laptop-15-6-Acer-Asus-Samsung-Toshiba-Chromebook-WaterProof-No/907179648?variantFieldId=actual_color,12.97,,0, 30 Day Money Back Guaranteed! 12-month free replacement warranty for manufacturer's defects! ,"Material: Made of polyester fabric outside and soft velvet inside. ,Protection: Provide with multiple-layer protection against dust, water, scratching or shocks. ,Convenient Access: Smooth top-loading zipper on the bag can glide smoothly, which allows for easy and convenient access to your laptop. Zipped large external pocket perfect for storing essentials such as mobile phones and charging leads, as well as accessories like pens and USB memory sticks. ,Waterproof: The material is durable and waterproof. There is no need to worry about spilling a drink or walking through the rain when your laptop is in this bag. ,Lightweight: Ultra slim lightweight design makes it convenient for your daily use, you can carry this to travel. ,Type: Laptop Sleeve Bag,Material: Polyester Fabric, Velvet,Color: Black, Gray ,Hardness: Soft,Open: Zipper,Suitable Laptop Size: 13 inch, 15.6 inch,Features: Waterproof, Dustproof, Wear-resistant,1 x Laptop Sleeve Bag,Ideal for MacBook Pro/Air, Surface, Chromebook, Laptops or Tablets Between 13-15.6 Inch,Superior Protection: Prevent your laptop from being dropped accidentally.,An extra front pocket can store items like pens, phones, cables, power banks, etc,Smooth top-loading zipper,Made of Water-resistant polyester material, against dust, scratching or shocks,Slim & Lightweight: Convenient for daily use & traveling wherever you go",Electronics
"Laptop Sleeve Case 15.6 Inch, WaterProof Laptop Sleeve 13 Inch- Notebook Computer Pocket Case - Tablet Briefcase Polyester Carrying Bag Compatible with Asus/Dell/Fujitsu/HP/Sony/Toshiba/Acer",https://www.walmart.com/ip/Laptop-Sleeve-Case-15-6-Inch-WaterProof-13-Inch-Notebook-Computer-Pocket-Tablet-Briefcase-Polyester-Carrying-Bag-Compatible-Asus-Dell-Fujitsu-HP-Sony/780138373?variantFieldId=actual_color,14.97,5.0,5, 30 Day Money Back Guaranteed! 12-month free replacement warranty for manufacturer's defects! ,"Material: Made of polyester fabric outside and soft velvet inside. ,Protection: Provide with multiple-layer protection against dust, water, scratching or shocks. ,Convenient Access: Smooth top-loading zipper on the bag can glide smoothly, which allows for easy and convenient access to your laptop. Zipped large external pocket perfect for storing essentials such as mobile phones and charging leads, as well as accessories like pens and USB memory sticks. ,Waterproof: The material is durable and waterproof. There is no need to worry about spilling a drink or walking through the rain when your laptop is in this bag. ,Lightweight: Ultra slim lightweight design makes it convenient for your daily use, you can carry this to travel. ,Type: Laptop Sleeve Bag,Material: Polyester Fabric, Velvet,Color: Black, Gray ,Hardness: Soft,Open: Zipper,Suitable Laptop Size: 13 inch, 15.6 inch,Features: Waterproof, Dustproof, Wear-resistant,1 x Laptop Sleeve Bag,Ideal for MacBook Pro/Air, Surface, Chromebook, Laptops or Tablets Between 13-15.6 Inch,Superior Protection: Prevent your laptop from being dropped accidentally.,An extra front pocket can store items like pens, phones, cables, power banks, etc,Smooth top-loading zipper,Made of Water-resistant polyester material, against dust, scratching or shocks,Slim & Lightweight: Convenient for daily use & traveling wherever you go",Electronics
"Crossbody Cell Phone Bag, Holographic Rave Fanny Pack for Women, Shinny Fashion PU Waterproof Waist Pack Belt Bum Bag with Adjustable Belt, Phone Pouch for Festival, Travel, Party, Date, Shopping",https://www.walmart.com/ip/Crossbody-Cell-Phone-Bag-Holographic-Rave-Fanny-Pack-Women-Shinny-Fashion-PU-Waterproof-Waist-Belt-Bum-Bag-Adjustable-Belt-Pouch-Festival-Travel-Part/512432680?variantFieldId=actual_color,8.47,,0,,,Clothing
"TSV Business Card Holder, Metal Credit Card Case, Pocket Business Name Card Wallet with 6 Card Slots, Aluminum Card Carrier for Men and Women, Suitable for Business and Daily Use (Black/Silver/Purple)",https://www.walmart.com/ip/TSV-Business-Card-Holder-Metal-Credit-Case-Pocket-Name-Wallet-6-Slots-Aluminum-Carrier-Men-Women-Suitable-Daily-Use-Black-Silver-Purple/567102703?variantFieldId=actual_color,6.57,,0,,,Clothing
"TSV 3/2/1Pack Safesound Personal Alarm Keychain, 130dB Personal Safety Alarms for Women Self Defense, Personal Portable Security Alarms with LED Lights",https://www.walmart.com/ip/TSV-3-2-1Pack-Safesound-Personal-Alarm-Keychain-130dB-Safety-Alarms-Women-Self-Defense-Portable-Security-LED-Lights/317083351?variantFieldId=actual_color,12.97,4.1,15,TSV 130DB Portable LED Emergency Self Defense Siren Safety Personal Whistle Buzzer Alarm Keychain. WOWParts team offers 30 days return or replacement quality warranty & lifetime technical supports. Please contact us freely if you need any further assistance.,"Type: Alarm buzzer keychain,Material: ABS and metal keychain,Color: Black,Net Weight: 1.1oz(30g),Dimensions: 2.44x1.57x0.79 in(62x40x20mm),100% brand new and high quality.,The personal alarm keychain features high-quality environment-friendly ABS shell and a metal keychain. Resistance to fall and crush, beautiful and durable, won't break in your most adverse conditions.,Built-in 130DB high output alarm: When you need help, you can pull out the contact pin, it emits an alarm sound instantaneously, frighten the stranger, when you don't need it, put it back.,Comes with a LED light, convenient for you walking in the darkness.,Multi functions: make this alarm a unique bag decoration while serves as a self-defense protection and a mini flashlight, is the protector of the darkness.,Small and lightweight design, with keychain for hanging on your handbag, backpack, belt loops, key, wallet and suitcases.,Ideal for women, children, elderly, disabled, joggers, night shift workers or people who live alone, protect against intruders, attackers. It's also a security necessity for traveling, hiking, camping and others dangerous situations.,Powered by 3 x IR44 button battery (included). The battery compartment needs to be screwed open by using a small screwdriver for new battery replacement.,1/2/3 x Alarm keychain,1/2/3 x User manual,125 - 130dB Mini Portable Emergency Personal Alarm Key-chain, Easy to use ,This personal alarm keychain is small and portable ,Ideal for women, children, elderly, disabled, joggers, night shift workers.",Health
"TSV Cell Phone Pouch Crossbody Bag, Women Girls Holographic Waist Pack Chest Bag, PU leather Waterproof Crossbody Fanny Pack Sport Bum Bag, Large Capacity Adjustable Phone Bag for up to 6in Phones",https://www.walmart.com/ip/TSV-Cell-Phone-Pouch-Crossbody-Bag-Women-Girls-Holographic-Waist-Pack-Chest-PU-leather-Waterproof-Fanny-Sport-Bum-Large-Capacity-Adjustable-Bag-6in-P/881307813?variantFieldId=actual_color,8.47,5.0,1,,,Clothing
"Travel Shoulder Bag, Fits for Nintendo Switch/Switch Lite Console, Joy-Con Grip & Switch Accessories, Protective Waterproof Storage Sling Backpack Shoulder Bag compatible Nintendo Switch and iPad",https://www.walmart.com/ip/Travel-Shoulder-Bag-Fits-Nintendo-Switch-Switch-Lite-Console-Joy-Con-Grip-Switch-Accessories-Protective-Waterproof-Storage-Sling-Backpack-Bag-compati/694681617?variantFieldId=actual_color,12.97,3.7,3,,,Clothing
"TSV Women Wallet Female Coin Purses Holders PU Leather Ladies Long Clutch Bags, Large Capacity Trifold Ladies Credit Card Holder Organizer Travel Snap Wallet Clutch Purses",https://www.walmart.com/ip/TSV-Women-Wallet-Female-Coin-Purses-Holders-PU-Leather-Ladies-Long-Clutch-Bags-Large-Capacity-Trifold-Credit-Card-Holder-Organizer-Travel-Snap/148473356,8.97,,0,,,Clothing
"TSV Small Crossbody Shoulder Bags, PU Leather Backpack with Back Headphone Hole, for Women Stylish Ladies Messenger Bags Purse and Handbags Clutch, Daypack for School, Dating, Shopping, Traveling",https://www.walmart.com/ip/TSV-Small-Crossbody-Shoulder-Bags-PU-Leather-Backpack-Back-Headphone-Hole-Women-Stylish-Ladies-Messenger-Bags-Purse-Handbags-Clutch-Daypack-School-Da/525675710?variantFieldId=actual_color,14.97,,0,,,Clothing
"Women Wallet Clutch Organizer, TSV Portable PU Matte Leather Zipper Wallet Coin Purse, RFID Bifold Fashionable Women Wallet for Cash, ID Cards, Credit Cards - Great Gift for Girl Friends, Colleagues",https://www.walmart.com/ip/Women-Wallet-Clutch-Organizer-TSV-Portable-PU-Matte-Leather-Zipper-Coin-Purse-RFID-Bifold-Fashionable-Cash-ID-Cards-Credit-Cards-Great-Gift-Girl-Frie/801500762?variantFieldId=actual_color,10.87,,0,,,Clothing
"TSV Switch Travel Bag with USB Charging Port, for Nintendo Switch Console & Accessories, Protective Storage Sling Backpack Shoulder Bag for Nintendo Switch and iPad",https://www.walmart.com/ip/TSV-Switch-Travel-Bag-USB-Charging-Port-Nintendo-Console-Accessories-Protective-Storage-Sling-Backpack-Shoulder-iPad/165099278?variantFieldId=actual_color,14.97,3.6,15,30 Day Money Back Guaranteed! 12-month free replacement warranty formanufacturer's defects! ,"The Portable Crossbody Travel Bag for Nintendo Switch/Switch Lite 2019, controller and other accessories.,Adjustable Strap: The storage switch bag offers much comfort, greatly relieves your shoulder.,USB Charging Interface: The crossbody chest bag can easily connect with your power bank, headphone.,Other Features: The sport travel bag is durable, water-proof and wear-resistant.,Offer One Year Warranty, Free Return & Exchange.",Video Games
"TSV Cell Phone Purse, PU Leather Crossbody Cell Phone Bag for Women, Small Crossbody Bag Cellphone Purse Wallet Clutch Wristlet Handbag with Credit Card Slots & Adjustable Shoulder Strap",https://www.walmart.com/ip/TSV-Cell-Phone-Purse-PU-Leather-Crossbody-Bag-Women-Small-Cellphone-Purse-Wallet-Clutch-Wristlet-Handbag-Credit-Card-Slots-Adjustable-Shoulder-Strap/632234517?variantFieldId=actual_color,13.97,4.0,1,,,Clothing
"Women Small Backpack, TSV Fashion Crossbody Shoulder Bags Handbag Purse, Adjustable PU Leather Travel Bag Ladies Messenger Bags, Outdoor Daypack Casual School Dating Backpacks for Women, Black/Pink",https://www.walmart.com/ip/Women-Small-Backpack-TSV-Fashion-Crossbody-Shoulder-Bags-Handbag-Purse-Adjustable-PU-Leather-Travel-Bag-Ladies-Messenger-Bags-Outdoor-Daypack-Casual-/155921183?variantFieldId=actual_color,14.97,2.0,1,,,Clothing
"Small Crossbody Cell Phone Purse for Women, Mini Messenger Shoulder Bag Wallet with Credit Card Slots, Adjustable Cell Phone Bag Fits for iPhone 11 Pro Max XR XS X 8P Galaxy Huawei, Up to 6.7"" Phone",https://www.walmart.com/ip/Small-Crossbody-Cell-Phone-Purse-Women-Mini-Messenger-Shoulder-Bag-Wallet-Credit-Card-Slots-Adjustable-Fits-iPhone-11-Pro-Max-XR-XS-X-8P-Galaxy-Huawe/888697273?variantFieldId=actual_color,13.97,,0,,,Clothing
"Cell Phone Purse for Women, Small PU Leather Crossbody Cellphone Bag Wallet with Card Slots & Zipper Closure, Adjustable Ladies Handbag Clutch Phone Pockets, Great Gift for Girls (Black/Pink/Red)",https://www.walmart.com/ip/Cell-Phone-Purse-Women-Small-PU-Leather-Crossbody-Cellphone-Bag-Wallet-Card-Slots-Zipper-Closure-Adjustable-Ladies-Handbag-Clutch-Pockets-Great-Gift-/731437490?variantFieldId=actual_color,13.97,,0,,,Clothing
"TSV Crossbody Phone Bags for Women, Small PU Leather Cellphone Purse Wallet, Adjustable Shoulder Bag Handbag Clutch Phone Pockets Fits for iPhone 8 Plus Xs Max X Xr 7/6 Plus Samsung S10+",https://www.walmart.com/ip/TSV-Crossbody-Phone-Bags-Women-Small-PU-Leather-Cellphone-Purse-Wallet-Adjustable-Shoulder-Bag-Handbag-Clutch-Pockets-Fits-iPhone-8-Plus-Xs-Max-X-Xr-/923093217?variantFieldId=actual_color,13.97,,0,,,Clothing
"TSV Lightweight Small Crossbody Bag Cell Phone Purse Wallet for Women, Waterproof Nylon Roomy Shoulder Bag, Cell Phone Purse Wallet with Adjustable Shoulder Strap and 4 Zipper Pockets for Smartphones",https://www.walmart.com/ip/TSV-Lightweight-Small-Crossbody-Bag-Cell-Phone-Purse-Wallet-Women-Waterproof-Nylon-Roomy-Shoulder-Bag-Adjustable-Strap-4-Zipper-Pockets-Smartphones/554462798?variantFieldId=actual_color,9.47,5.0,16,,,Clothing
"Small PU Leather Wallet for Women, TSV Matte Wallet Credit Card Holder, Zipper Coin Purse Short Purse, Mini Pocket Purse Slim Compact Organizer, Portable Travel Clutch, Valentine's Gift for Girl",https://www.walmart.com/ip/Small-PU-Leather-Wallet-Women-TSV-Matte-Credit-Card-Holder-Zipper-Coin-Purse-Short-Purse-Mini-Pocket-Slim-Compact-Organizer-Portable-Travel-Clutch-Va/313264328?variantFieldId=actual_color,10.97,,0,,,Clothing
"Women's RFID Bifold Leather Small Wallet, Ladies Mini Purse with Coin Pocket, Vintage Zipper Buckle Matte Wallet, Card Holder Coin Purse, Travel Short Wallet, Soft Compact Thin Wallet, Gift for Mother",https://www.walmart.com/ip/Women-s-RFID-Bifold-Leather-Small-Wallet-Ladies-Mini-Purse-Coin-Pocket-Vintage-Zipper-Buckle-Matte-Card-Holder-Purse-Travel-Short-Soft-Compact-Thin-G/492602417?variantFieldId=actual_color,10.97,,0,,,Clothing
"TSV Luggage Straps, Adjustable 2pcs Travel Luggage Packing Belt Suitcase Strap, or Cross Luggage Strap with Tags Slot & Secure Buckle, Lightweight Baggage Backpack Travel Bag Belt, 5 Bright Colors",https://www.walmart.com/ip/TSV-Luggage-Straps-Adjustable-2pcs-Travel-Packing-Belt-Suitcase-Strap-Cross-Strap-Tags-Slot-Secure-Buckle-Lightweight-Baggage-Backpack-Bag-Belt-5-Bri/162708436?variantFieldId=actual_color,7.97,,0,,,Clothing
"TSV 2PCS Adjustable Travel Luggage Packing Belt Suitcase Strap, or Cross Luggage Strap, Nylon Packing Belt Baggage Backpack Strap, Travel Accessories Long Cross Strap, Fits for 20""-28"" Suitcase",https://www.walmart.com/ip/TSV-2PCS-Adjustable-Travel-Luggage-Packing-Belt-Suitcase-Strap-Cross-Nylon-Baggage-Backpack-Accessories-Long-Fits-20-28/315477261?variantFieldId=actual_color,7.97,,0,,,Clothing
"TSV Travel Luggage Suitcase Strap, Adjustable Cross Luggage Strap Suitcase Belts with Luggage Tags Slot/2pcs Luggage Packing Belt, with Quick Release Buckle, Bright Color Baggage Backpack Bag Belt",https://www.walmart.com/ip/TSV-Travel-Luggage-Suitcase-Strap-Adjustable-Cross-Strap-Belts-Tags-Slot-2pcs-Packing-Belt-Quick-Release-Buckle-Bright-Color-Baggage-Backpack-Bag-Bel/851762222?variantFieldId=actual_color,7.97,,0,,,Clothing
"TSV RFID Blocking Credit Card Holder, Leather Wallets with Zipper, Credit Card Organizer Wallet, Large Capacity Leather Clutch Wallet for Women Men Travel Shopping Working Use (Black/Brown/Purple)",https://www.walmart.com/ip/TSV-RFID-Blocking-Credit-Card-Holder-Leather-Wallets-Zipper-Organizer-Wallet-Large-Capacity-Clutch-Wallet-Women-Men-Travel-Shopping-Working-Use-Black/469724872?variantFieldId=actual_color,14.97,,0,,,Clothing
"TSV 10/5Pcs Reusable Net Produce Bags, Hanging Mesh Storage Bag for Washable Fruit& Vegetable Keeping, Potato, Garlic, Onion Breathable Keeper with Handle, Grocery Shopping Totes, Long Lasting Durable",https://www.walmart.com/ip/TSV-10-5Pcs-Reusable-Net-Produce-Bags-Hanging-Mesh-Storage-Bag-Washable-Fruit-Vegetable-Keeping-Potato-Garlic-Onion-Breathable-Keeper-Handle-Grocery-/689958105,10.97,,0,,,Home
"TSV PU Leather Sling Bag, Men's Shoulder Chest Crossbody Backpack, Waterproof Casual Chest Bags with USB Charging Port & Earphone Hole for Travel, Hiking, Cycling (Dark Brown/Light Brown/Black)",https://www.walmart.com/ip/TSV-PU-Leather-Sling-Bag-Men-s-Shoulder-Chest-Crossbody-Backpack-Waterproof-Casual-Bags-USB-Charging-Port-Earphone-Hole-Travel-Hiking-Cycling-Dark-Br/375372512?variantFieldId=actual_color,11.97,,0,,,Clothing
"TSV Switch Travel Bag with USB Charging Port, for Nintendo Switch Console & Accessories, Protective Storage Sling Backpack Shoulder Bag for Nintendo Switch and iPad",https://www.walmart.com/ip/TSV-Switch-Travel-Bag-USB-Charging-Port-Nintendo-Console-Accessories-Protective-Storage-Sling-Backpack-Shoulder-iPad/623778962?variantFieldId=actual_color,14.97,3.6,15,,,Clothing
"TSV Messenger Crossbody Bag Handbag for Women - PU Leather Women Handbag - Womens Shoulder Bag Top Handle Fashion Pocketbook Ladies Leather Satchel Tote, Adjustable Shoulder Strap",https://www.walmart.com/ip/TSV-Messenger-Crossbody-Bag-Handbag-Women-PU-Leather-Womens-Shoulder-Top-Handle-Fashion-Pocketbook-Ladies-Satchel-Tote-Adjustable-Strap/550394660?variantFieldId=actual_color,9.67,2.8,4,,,Clothing
"TSV Unisex Phone Crossbody Shoulder Bag, Small Cellphone Crossbody Shoulder Bag Travel Satchel Waist Belt Bag Purse for iPhone Xs Max/XR/X/8/8 Plus   ,Samsung Galaxy Note 9/8, S10 S10E S9 S8",https://www.walmart.com/ip/TSV-Unisex-Phone-Crossbody-Shoulder-Bag-Small-Cellphone-Bag-Travel-Satchel-Waist-Belt-Purse-iPhone-Xs-Max-XR-X-8-8-Plus-Samsung-Galaxy-Note-9-8-S10-S/770465245?variantFieldId=actual_color,9.47,5.0,4,,,Clothing
"TSV Business Card Holder, Metal Credit Card Case, Pocket Business Name Card Wallet with 6 Card Slots, Aluminum Card Carrier for Men and Women, Suitable for Business and Daily Use (Black/Silver/Purple)",https://www.walmart.com/ip/TSV-Business-Card-Holder-Metal-Credit-Case-Pocket-Name-Wallet-6-Slots-Aluminum-Carrier-Men-Women-Suitable-Daily-Use-Black-Silver-Purple/282077532?variantFieldId=actual_color,6.57,,0,,,Clothing
"TSV Cell Phone Shoulder Strap Wallet, Light Weight Cross-Body Purse Case Pouch Small Messenger Bag for Hold   Phone/Keys/Money/Cards/Wallet/Headphones/Passport/Tickets",https://www.walmart.com/ip/TSV-Cell-Phone-Shoulder-Strap-Wallet-Light-Weight-Cross-Body-Purse-Case-Pouch-Small-Messenger-Bag-Hold-Phone-Keys-Money-Cards-Wallet-Headphones-Passp/890045589?variantFieldId=actual_color,9.47,,0,,,Clothing
"TSV Tote Shoulder Bag for Women PU Leather Tote Top Handle Handbags ladies Purse Messenger Crossbody Bags for Womens Handbag Adjustable Strap,  Suitable for Traveling, Shopping, Dating or Daily use",https://www.walmart.com/ip/TSV-Tote-Shoulder-Bag-Women-PU-Leather-Top-Handle-Handbags-ladies-Purse-Messenger-Crossbody-Bags-Womens-Handbag-Adjustable-Strap-Suitable-Traveling-S/434853065?variantFieldId=actual_color,9.67,,0,,,Clothing
"Cell Phone Pouch, TSV Casual Water Resistant Nylon Mini Cross-Body Cell Phone Shoulder Strap Wallet Pouch Bag Purse for iPhone XS XR XS Max 8 Plus Samsung S10 S9 S7 Edge LG G7 G6 V40 V30 and More",https://www.walmart.com/ip/Cell-Phone-Pouch-TSV-Casual-Water-Resistant-Nylon-Mini-Cross-Body-Shoulder-Strap-Wallet-Pouch-Bag-Purse-iPhone-XS-XR-Max-8-Plus-Samsung-S10-S9-S7-Edg/234761330?variantFieldId=actual_color,9.47,4.3,12,,,Clothing
"TSV Small Crossbody Cell Phone Pouch Purse for Women, Waterproof Mini Messenger Shoulder Bag Wallet with Credit Card Slots & Adjustable Straps Wristlet Wallet Bag Coin Purse for Most Cellphones",https://www.walmart.com/ip/TSV-Small-Crossbody-Cell-Phone-Pouch-Purse-Women-Waterproof-Mini-Messenger-Shoulder-Bag-Wallet-Credit-Card-Slots-Adjustable-Straps-Wristlet-Coin-Most/461779686?variantFieldId=actual_color,9.47,4.3,7,WOWParts team offers 30 days return or replacement quality warranty &lifetime technical supports. Please contact us freely if you need anyfurhterassistance.,"Cellphone pouch design with waterproof nylon, durable and nice appearance. ,Light weight with adjustable shoulder strap, convenient for carry on. ,L size bags are designed with earphone hole for enjoying music. ,Phone bag fits for most smartphones up to 6.5 inch. ,Suitable for sports, shopping, travel and everyday wear.",Cell Phones
"TSV Women Leather Wallet, RFID Blocking Small Bifold Zipper Pocket Wallet, Card Case Coin Purse with ID Window & Snap, Women's Short Compact Thin Wallet, Portable Handbag for Traveling Outdoors",https://www.walmart.com/ip/TSV-Women-Leather-Wallet-RFID-Blocking-Small-Bifold-Zipper-Pocket-Card-Case-Coin-Purse-ID-Window-Snap-Women-s-Short-Compact-Thin-Portable-Handbag-Tra/663952836?variantFieldId=actual_color,10.87,4.8,6,,,Clothing
"TSV PU Leather Wallet, Slim Card Holder Purse, Tassel Zipper Clutch with Large Capacity, Multi-Slots Long Wallet, Bifold Pocket Card Organizer, Great Gift for Women Ladies (Black/Light Coffee Color)",https://www.walmart.com/ip/TSV-PU-Leather-Wallet-Slim-Card-Holder-Purse-Tassel-Zipper-Clutch-Large-Capacity-Multi-Slots-Long-Bifold-Pocket-Organizer-Great-Gift-Women-Ladies-Bla/885120809,8.97,,0,,,Clothing
"Women Wallet Clutch Organizer, TSV Portable PU Matte Leather Zipper Wallet Coin Purse, RFID Bifold Fashionable Women Wallet for Cash, ID Cards, Credit Cards - Great Gift for Girl Friends, Colleagues",https://www.walmart.com/ip/Women-Wallet-Clutch-Organizer-TSV-Portable-PU-Matte-Leather-Zipper-Coin-Purse-RFID-Bifold-Fashionable-Cash-ID-Cards-Credit-Cards-Great-Gift-Girl-Frie/403775416,10.87,,0,,,Clothing
"Women's RFID Bifold Leather Small Wallet, Ladies Mini Purse with Coin Pocket, Vintage Zipper Buckle Matte Wallet, Card Holder Coin Purse, Travel Short Wallet, Soft Compact Thin Wallet, Gift for Mother",https://www.walmart.com/ip/Women-s-RFID-Bifold-Leather-Small-Wallet-Ladies-Mini-Purse-Coin-Pocket-Vintage-Zipper-Buckle-Matte-Card-Holder-Purse-Travel-Short-Soft-Compact-Thin-G/429135079,10.97,,0,,,Clothing
"TSV Cell Phone Purse, PU Leather Crossbody Cell Phone Bag for Women, Small Crossbody Bag Cellphone Purse Wallet Clutch Wristlet Handbag with Credit Card Slots & Adjustable Shoulder Strap",https://www.walmart.com/ip/TSV-Cell-Phone-Purse-PU-Leather-Crossbody-Bag-Women-Small-Cellphone-Purse-Wallet-Clutch-Wristlet-Handbag-Credit-Card-Slots-Adjustable-Shoulder-Strap/571191364,13.97,4.0,1,,,Clothing
"PU Leather Wallet for Women Slim Clutch Long Designer Trifold Ladies Credit Card Holder Organizer, Large Capacity Long Travel Snap Wallet Clutch Purses",https://www.walmart.com/ip/PU-Leather-Wallet-Women-Slim-Clutch-Long-Designer-Trifold-Ladies-Credit-Card-Holder-Organizer-Large-Capacity-Travel-Snap-Purses/295238006,8.97,4.0,1,,,Clothing
"Fashion Women Wallet, TSV Faux Leather Women Wallet with Multi-storey Fold [Large Capacity] for Cash, Bills, Credit Cards and Coin Organizer, Women Clutch Leather Wallet for Girl Friends Ladies",https://www.walmart.com/ip/Fashion-Women-Wallet-TSV-Faux-Leather-Wallet-Multi-storey-Fold-Large-Capacity-Cash-Bills-Credit-Cards-Coin-Organizer-Clutch-Girl-Friends-Ladies/979489271,11.47,,0,,,Clothing
"TSV Business Card Holder, Metal Credit Card Case, Pocket Business Name Card Wallet with 6 Card Slots, Aluminum Card Carrier for Men and Women, Suitable for Business and Daily Use (Black/Silver/Purple)",https://www.walmart.com/ip/TSV-Business-Card-Holder-Metal-Credit-Case-Pocket-Name-Wallet-6-Slots-Aluminum-Carrier-Men-Women-Suitable-Daily-Use-Black-Silver-Purple/337403457,6.57,,0,,,Clothing
"TSV Travel Shoulder Backpack Bag for Nintendo Switch Console, Dock, Joy-Con Grip & Switch Accessories, w/ USB Charging Interface Protective Storage Sling Shoulder Chest Bag for Nintendo Switch, iPad",https://www.walmart.com/ip/TSV-Travel-Shoulder-Backpack-Bag-Nintendo-Switch-Console-Dock-Joy-Con-Grip-Accessories-w-USB-Charging-Interface-Protective-Storage-Sling-Chest-Switch/485933216,13.47,,0,,,Clothing
Waterproof Running Belt Bum Waist Pouch Fanny Pack Camping Sport Hiking Zip Bag,https://www.walmart.com/ip/Waterproof-Running-Belt-Bum-Waist-Pouch-Fanny-Pack-Camping-Sport-Hiking-Zip-Bag/297243199,6.97,,0,,,Clothing
