title,url,price,avg_review,num_reviews,desc_text,desc_list,prod_category
NICE CAPS Little Girls and Infants Sherpa Lined Snowflake Design Knitted Hat Mitten Scarf Cold Weather Winter Accessory Set - Fits Baby Toddler Kids Childrens Sizes,https://www.walmart.com/ip/NICE-CAPS-Little-Girls-Infants-Sherpa-Lined-Snowflake-Design-Knitted-Hat-Mitten-Scarf-Cold-Weather-Winter-Accessory-Set-Fits-Baby-Toddler-Kids-Childr/152101115,21.99,,0,,,Clothing
NICE CAPS Kids Boys Girls Waterproof Secure-Wrap Mittens with Elbow Length Cuff,https://www.walmart.com/ip/NICE-CAPS-Kids-Boys-Girls-Waterproof-Secure-Wrap-Mittens-with-Elbow-Length-Cuff/191622549,15.99,,0,,,Clothing
NICE CAPS Girls Chevron Soft Sherpa Lined Hat/Scarf/Mitten Set,https://www.walmart.com/ip/NICE-CAPS-Girls-Chevron-Soft-Sherpa-Lined-Hat-Scarf-Mitten-Set/775976401,13.99,,0,,,Clothing
Infant & Toddler Girls Pink Fleece Flower Hat & Mittens Beanie Set,https://www.walmart.com/ip/Infant-Toddler-Girls-Pink-Fleece-Flower-Hat-Mittens-Beanie-Set/338371804,16.49,,0,,,Clothing
Nice Caps Infant Toddler Boys Black Fleece Trapper Hat Mittens Set Aviator,https://www.walmart.com/ip/Nice-Caps-Infant-Toddler-Boys-Black-Fleece-Trapper-Hat-Mittens-Set-Aviator/208238322,14.49,,0,,,Clothing
NICE CAPS Big And Little Kids Thinsulate Lined Insulated Winter Converter Fingerless Glove To Mitten - Fits Boys Girls Toddler Children Youth Sizes For Cold Weather,https://www.walmart.com/ip/NICE-CAPS-Big-And-Little-Kids-Thinsulate-Lined-Insulated-Winter-Converter-Fingerless-Glove-To-Mitten-Fits-Boys-Girls-Toddler-Children-Youth-Sizes-For/178937480,38.00,,0,,,Clothing
NICE CAPS Kids Extreme Cold Weather 80 Gram Thinsulate and Waterproof Ski Snow Winter Gloves - Fits Boys Girls Toddler Childrens Youth Child Sizes,https://www.walmart.com/ip/NICE-CAPS-Kids-Extreme-Cold-Weather-80-Gram-Thinsulate-and-Waterproof-Ski-Snow-Winter-Gloves-Fits-Boys-Girls-Toddler-Childrens-Youth-Child-Sizes/121647986,39.00,5.0,1,"NICE CAPS Kids Extreme Cold Weather 80 Gram Thinsulate Ski GlovesN'Ice Caps Kids 80 gram Thinsulate and waterproof ski glove. 80 gram 3M Thinsulate recommended for extreme cold weather. Colors available: black, fuchsia, turquoise, dark purple, navy, light purple. Sizes: One size fits 3-5yrs (product care label says 3-4yrs, but we recommend for 3-5yrs) (3.5"" across palm of glove, 5.5"" from elastic to end of middle finger of glove); One size fits 5-6yrs (product care label says 4-5yrs, but we recommend for 5-6yrs) (3.75 inches across palm, 5.75 inches from elastic to end of middle glove finger); One size fits 6-7yrs (4"" across palm of glove, 6"" from elastic to end of middle finger of glove); One size fits 8-9yrs (4.25 inches across palm, 6.25 from elastic to end of middle glove finger); One size fits 10-12yrs (4.25"" across palm of glove, 6.5"" from elastic to end of middle finger of glove); One size fits 13-15yrs (4.5"" across palm of glove, 7"" from elastic to end of middle finger of glove). Tested and approved as per CPSIA standards.",,Home Improvement
NICE CAPS Little Boys and Infants Buffalo Plaid Fleece Trooper Hat and Mitten Set,https://www.walmart.com/ip/NICE-CAPS-Little-Boys-and-Infants-Buffalo-Plaid-Fleece-Trooper-Hat-and-Mitten-Set/158595706,16.99,,0,,,Clothing
N'Ice Caps Girls Waterproof Snowproof Windproof Insulated Fashion Artwork Printed Winter Gloves,https://www.walmart.com/ip/NICE-CAPS-Girls-Kids-Thinsulate-Waterproof-Winter-Flower-Print-Snow-Ski-Gloves-Fits-Childrens-Childs-Youth-Toddlers-For-Cold-Weather/489899782?variantFieldId=actual_color,16.99,,0,,,Clothing
NICE CAPS Baby Girls 2 Ply Micro Fleece Hat And Mitten With Appliques,https://www.walmart.com/ip/NICE-CAPS-Baby-Girls-2-Ply-Micro-Fleece-Hat-And-Mitten-With-Appliques/750238193,12.99,,0,,,Clothing
N'Ice Caps Women's Warm Sherpa Lined Fleece Touchscreen Gloves,https://www.walmart.com/ip/N-Ice-Caps-Women-s-Warm-Sherpa-Lined-Fleece-Touchscreen-Gloves/601130694?variantFieldId=actual_color,11.99,,0,,,Clothing
NICE CAPS Baby Girls Infants Solid to Print Reversible Summer Sun Bonnet Cap Hat Headwear,https://www.walmart.com/ip/NICE-CAPS-Baby-Girls-Infants-Solid-to-Print-Reversible-Summer-Sun-Bonnet-Cap-Hat-Headwear/502774046?variantFieldId=actual_color,10.99,,0,,,Clothing
NICE CAPS Little Girls and Toddler Warm Fleece Lined Knitted 3 Piece Hat Scarf Mitten Cold Weather Winter Headwear Accessory Set with Poms - Fits Children Kids Sizes,https://www.walmart.com/ip/NICE-CAPS-Little-Girls-Toddler-Warm-Fleece-Lined-Knitted-3-Piece-Hat-Scarf-Mitten-Cold-Weather-Winter-Headwear-Accessory-Set-Poms-Fits-Children-Kids-/119988164?variantFieldId=actual_color,17.99,,0,,,Clothing
N'Ice Caps Women's Thinsulate and Waterproof Fashion Print Zig Zag Winter Gloves,https://www.walmart.com/ip/N-Ice-Caps-Women-s-Thinsulate-and-Waterproof-Fashion-Print-Zig-Zag-Winter-Gloves/171444694,13.99,,0,,,Clothing
NICE CAPS Womens Ladies Fleece Lined Cable Knit 3 Piece Hat/Scarf/Glove Winter Cold Weather Headwear Accessory Set With Metallic Specks - For Adults,https://www.walmart.com/ip/NICE-CAPS-Womens-Ladies-Fleece-Lined-Cable-Knit-3-Piece-Hat-Scarf-Glove-Winter-Cold-Weather-Headwear-Accessory-Set-With-Metallic-Specks-For-Adults/167271346,15.99,4.3,4,,,Clothing
N'Ice Caps Kids Waterproof Snowproof Windproof Insulated Winter Gloves | Essential Winter Gear for Boys and Girls,https://www.walmart.com/ip/N-Ice-Caps-Kids-Waterproof-Snowproof-Windproof-Insulated-Winter-Gloves-Essential-Winter-Gear-for-Boys-and-Girls/837589346?variantFieldId=actual_color,17.99,4.5,2,,,Clothing
NICE CAPS Womens Ladies Adults Premium Waterproof and Thinsulate Insulated Winter Ski Skiing Snow Snowboarder Gloves,https://www.walmart.com/ip/NICE-CAPS-Womens-Ladies-Adults-Premium-Waterproof-and-Thinsulate-Insulated-Winter-Ski-Skiing-Snow-Snowboarder-Gloves/182175761?variantFieldId=actual_color,14.99,5.0,5,,,Clothing
NICE CAPS Womens Ladies Adults Cold Weather Thinsulate Waterproof Ridges Winter Ski Snow Gloves,https://www.walmart.com/ip/NICE-CAPS-Womens-Ladies-Adults-Cold-Weather-Thinsulate-Waterproof-Ridges-Winter-Ski-Snow-Gloves/147229680?variantFieldId=actual_color,13.99,4.7,19,,,Clothing
NICE CAPS Womens Adults Ladies Solid Lined Cable Knit Hat/Scarf/Gloves Winter Snow 3 Piece Accessory Set,https://www.walmart.com/ip/NICE-CAPS-Womens-Adults-Ladies-Solid-Lined-Cable-Knit-Hat-Scarf-Gloves-Winter-Snow-3-Piece-Accessory-Set/909109113,27.99,,0,,,Clothing
N'Ice Caps Womens Merino Wool Touchscreen Gloves Winter Cold Weather Womens Accessories,https://www.walmart.com/ip/N-Ice-Caps-Womens-Merino-Wool-Touchscreen-Gloves-Winter-Cold-Weather-Womens-Accessories/314080079,13.99,,0,,,Clothing
NICE CAPS Womens Bulky Cable Knit 3 Piece Hat Scarf Glove Winter Headwear Accessory Set With Warm Sherpa Lining - Fits Ladies Adults for Cold Weather,https://www.walmart.com/ip/NICE-CAPS-Womens-Bulky-Cable-Knit-3-Piece-Hat-Scarf-Glove-Winter-Headwear-Accessory-Set-With-Warm-Sherpa-Lining-Fits-Ladies-Adults-for-Cold-Weather/124121979,23.99,5.0,1,,,Clothing
NICE CAPS Womens Ladies Adults Bulky Cable Knit Hat/Scarf/Converter Glove 3 Piece Winter Snow Headwear Accessory Set,https://www.walmart.com/ip/NICE-CAPS-Womens-Ladies-Adults-Bulky-Cable-Knit-Hat-Scarf-Converter-Glove-3-Piece-Winter-Snow-Headwear-Accessory-Set/187253425,26.99,,0,,,Clothing
NICE CAPS Womens Ladies Fleece Lined Cable Knit 3 Piece Hat/Scarf/Glove Winter Cold Weather Headwear Accessory Set With Metallic Specks - For Adults,https://www.walmart.com/ip/NICE-CAPS-Womens-Ladies-Fleece-Lined-Cable-Knit-3-Piece-Hat-Scarf-Glove-Winter-Cold-Weather-Headwear-Accessory-Set-With-Metallic-Specks-For-Adults/155454689,15.99,4.3,4,,,Clothing
NICE CAPS Womens Ladies Extreme Cold Weather 80 Gram Thinsulate Winter Premier Waterproof Colorblock Ski Snow Snowboarder Glove with Air Hole,https://www.walmart.com/ip/NICE-CAPS-Womens-Ladies-Extreme-Cold-Weather-80-Gram-Thinsulate-Winter-Premier-Waterproof-Colorblock-Ski-Snow-Snowboarder-Glove-with-Air-Hole/122220292?variantFieldId=actual_color,14.99,,0,,,Clothing
N'ICE CAPS Girls Fleece Winter Hat and Mittens Set 2-Ply Fleece with Fuzzy Sherpa Lining 4-Corner Ski Hat - Infants Toddlers Kids Sizes,https://www.walmart.com/ip/N-ICE-CAPS-Girls-Fleece-Winter-Hat-and-Mittens-Set-2-Ply-Fleece-with-Fuzzy-Sherpa-Lining-4-Corner-Ski-Hat-Infants-Toddlers-Kids-Sizes/356742068?variantFieldId=actual_color,13.99,4.6,8,N'Ice Caps girls sherpa lined micro fleece hat and mitten set.N'ICE CAPS Girls Fleece Winter Hat and Mittens Set 2-Ply Fleece with Fuzzy Sherpa Lining 4-Corner Ski Hat - Infants Toddlers Kids Sizes,,
NICE CAPS Womens Crocheted Chenille 3 Piece Hat/Scarf/Glove Winter Headwear Accessory Cold Weather Set With Warm Fleece Lining,https://www.walmart.com/ip/NICE-CAPS-Womens-Crocheted-Chenille-3-Piece-Hat-Scarf-Glove-Winter-Headwear-Accessory-Cold-Weather-Set-With-Warm-Fleece-Lining/132932924?variantFieldId=actual_color,14.99,3.5,4,,,Clothing
NICE CAPS Women's 3PC Fully Lined Micro Fleece Accessory Set,https://www.walmart.com/ip/NICE-CAPS-Women-s-3PC-Fully-Lined-Micro-Fleece-Accessory-Set/192148522?variantFieldId=actual_color,17.99,,0,,,Clothing
NICE CAPS Womens Iceland Yarn And Feather Circle Infinity Scarf For Winter Snow Cold Weather - Fits Ladies Adults Sizes,https://www.walmart.com/ip/NICE-CAPS-Womens-Iceland-Yarn-And-Feather-Circle-Infinity-Scarf-For-Winter-Snow-Cold-Weather-Fits-Ladies-Adults-Sizes/128525044,9.99,,0,,,Clothing
NICE CAPS Women's 3PC Fully Lined Micro Fleece Accessory Set,https://www.walmart.com/ip/NICE-CAPS-Women-s-3PC-Fully-Lined-Micro-Fleece-Accessory-Set/147480512,17.99,,0,,,Clothing
NICE CAPS Womens Ladies Adults Bulky Cable Knit Hat/Scarf/Converter Glove 3 Piece Winter Snow Headwear Accessory Set,https://www.walmart.com/ip/NICE-CAPS-Womens-Ladies-Adults-Bulky-Cable-Knit-Hat-Scarf-Converter-Glove-3-Piece-Winter-Snow-Headwear-Accessory-Set/120403617,26.99,,0,,,Clothing
roxy women's oceanside vicose pant,https://www.walmart.com/ip/Herschel-Supply-Co-Kids-Heritage-XL-Youth-Aster-Purple-Saddle-Brown/635841163?variantFieldId=actual_color,55.30,4.5,6,,,Clothing
Men's Columbia Elevated Leather Reversible Casual Belt Black Brown,https://www.walmart.com/ip/Men-s-Columbia-Elevated-Leather-Reversible-Casual-Belt-Black-Brown/274190788,49.00,,0,,,Clothing
etnies Scout Navy/Tan/White,https://www.walmart.com/ip/Florsheim-Getaway-Fisherman-Sandal-Brown/770883888?variantFieldId=actual_color,500.00,4.2,108,"On the lookout for an awesome performance sneaker? Look no further than etnies Scout shoe!Breathable mesh upper. Soft lining for comfort. Exposed STI Evolution Foam midsole with rubber pods.STI Foam Lite Level 1 footbed. Full lace-up closure. etnies logo details on tongue, side, and outsole. Imported. Product measurements were taken using size 12, width D - Medium. Please note that measurements may vary by size.Weight of footwear is based on a single item, not a pair.Measurements: Weight: 7 ozetnies Scout Navy/Tan/White",,
Men's Columbia Elevated Leather Reversible Casual Belt Brown Black,https://www.walmart.com/ip/Men-s-Columbia-Elevated-Leather-Reversible-Casual-Belt-Brown-Black/468536664,46.00,,0,,,Clothing
Men's Columbia Stitched Bridle Leather Belt Brown,https://www.walmart.com/ip/Men-s-Columbia-Stitched-Bridle-Leather-Belt-Brown/347093685,42.00,,0,,,Clothing
Columbia Unisex 8-20 Fast Trek Glove,https://www.walmart.com/ip/Columbia-Unisex-8-20-Fast-Trek-Glove/160817530,45.78,,0,,,Clothing
Sam Edelman Khloe Bright White Nappa Verona Leather,https://www.walmart.com/ip/Sam-Edelman-Hazel-Baltic-Navy-Suede-Leather/564858767,83.00,4.3,71,,,Clothing
Men's Columbia Genuine Leather Traveler Extra-Capacity Wallet Brown,https://www.walmart.com/ip/Men-s-Columbia-Genuine-Leather-Traveler-Extra-Capacity-Wallet-Brown/905882367,71.00,,0,,,Clothing
Mod-o-doc Zuma Short Sleeve Polo White  1,https://www.walmart.com/ip/Women-s-SoftWalk-Helena-Ankle-Boot/468334031?variantFieldId=actual_color,,4.2,120,,,Clothing
Lucky Brand Sundry Pocket Tee Mahogany,https://www.walmart.com/ip/Lilly-Pulitzer-Lanette-Top-Resort-White/808015150?variantFieldId=actual_color,500.00,,0,"The Lucky Brand Sundry Pocket Tee is crafted in soft cotton, and is washed to look and feel like an old favorite. Crew neckline.Short sleeves.Chest pocket.Logo tag at left side. Straight hemline. 100% cotton.Machine wash cold, tumble dry low.Imported.Product measurements were taken using size MD. Please note that measurements may vary by size.Measurements: Length: 27 inLucky Brand Sundry Pocket Tee Mahogany",,
Trotters Estee Brown Croco,https://www.walmart.com/ip/Herschel-Supply-Co-Heritage-Backpack/898892803,57.00,5.0,1,,,Clothing
"Kenneth Cole REACTION Men's Avery Slip on Loafer, Brown, Size 7.0",https://www.walmart.com/ip/Alternative-The-Luxe-Crew-3-Pack-Bundle-Navy-Heather-Grey-White/129784824,73.00,4.1,9,,,Clothing
Columbia PFG Fish Flag Mesh Flexfit Ball Cap S/M Tusk/ Fish Flag,https://www.walmart.com/ip/Columbia-PFG-Fish-Flag-Mesh-Flexfit-Ball-Cap-S-M-Tusk-Fish-Flag/192497098,23.01,,0,,,Clothing
Columbia PFG Fish Flag Mesh Flexfit Ball Cap L/XL Tusk/ Fish Flag,https://www.walmart.com/ip/Columbia-PFG-Fish-Flag-Mesh-Flexfit-Ball-Cap-L-XL-Tusk-Fish-Flag/670988167,19.73,,0,,,Clothing
"Columbia PFG Fish Flag Mesh Flexfit Ball Cap, Large/xlarge, Titanium/ Fish Flag",https://www.walmart.com/ip/Columbia-PFG-Fish-Flag-Mesh-Flexfit-Ball-Cap-Large-xlarge-Titanium-Fish-Flag/626250268,22.94,,0,,,Clothing
Florsheim Oval Penny Driver Mushroom Suede/Brown Suede,https://www.walmart.com/ip/NYDJ-Blouse-w-Pleated-Back-Avalon-Bloom/867093026?variantFieldId=actual_color,37.78,4.8,545,,,Clothing
Kenneth Cole Reaction Crosshatch Stretch Slim Dress Pants Tan,https://www.walmart.com/ip/Florsheim-Kids-Supacush-Plain-Toe-Ox-Jr-Toddler-Little-Kid-Big-Kid-Sand-Suede-Brick-Sole/248549393,55.00,4.8,532,,,Clothing
MCM Visetos Slide Cognac,https://www.walmart.com/ip/Natori-Devotion-Contour-Underwire-Bra-722179-Deep-Purple-Mulberry-Purple/558625585,40.00,4.8,533,,,Clothing
Kenneth Cole New York The Mover Chukka Brown,https://www.walmart.com/ip/Skechers-Stamina-Cutback-Men-s-Shoes-Taupe-Black/614345145,40.00,4.7,1038,,,Clothing
ECCO ST1 Hybrid Brogue Tie Cognac,https://www.walmart.com/ip/Women-s-Merrell-Dassie-Stitch-Buckle-Slip-On/293783199?variantFieldId=actual_color,168.00,4.4,130,,,Clothing
CC Corso Como Liesbeth Chocolate,https://www.walmart.com/ip/UGG-Jane-Patent-Jasmine/660218431,79.90,4.6,10,,,Clothing
MICHAEL Michael Kors Lillie Large Chain Shoulder Tote Brown/Acorn,https://www.walmart.com/ip/Kenneth-Cole-Reaction-Klay-Flex-Chukka-Cognac/888685438,299.00,,0,"Upgrade your ensemble when you finish your look with the MICHAEL Michael Kors Lillie Large Chain Shoulder Tote. Made of synthetic material.Snap with zipper closure.Top shoulder strap.Exterior back zip pocket.Signature logo hardware detail at front. Flat bottom.Lined interior. Interior zip and slip pockets.Imported.This product may have a manufacturer's warranty. Please visit the manufacturer's website or contact us at warranty@support.ours.com for full manufacturer warranty details.Please note, the hardware color and interior lining may differ from the color shown in the photo.Measurements: Bottom Width: 13 in Depth: 4 in Height: 11 in Strap Length: 20 in Strap Drop: 10 in Weight: 2 lbs 2 ozMICHAEL Michael Kors Lillie Large Chain Shoulder Tote Brown/Acorn",,
Men's Columbia Feather-Edge Stretch Belt Brown,https://www.walmart.com/ip/Men-s-Columbia-Feather-Edge-Stretch-Belt-Brown/342135239,50.00,,0,,,Clothing
Columbia Double Loop-Stitched Leather Belt - Extended Size Brown,https://www.walmart.com/ip/Columbia-Double-Loop-Stitched-Leather-Belt-Extended-Size-Brown/128104944,49.00,,0,,,Clothing
"Pulse Women's Plus Size Technical Insulated Ski Snow Pants, Juice Melon, 2X",https://www.walmart.com/ip/Pulse-Women-s-Plus-Size-Technical-Insulated-Ski-Snow-Pants-Juice-Melon-2X/211510444,23.70,,0,,,Clothing
Sunglasses Columbia C 540 S PEAKBAGGER 244 TORTOISE / BROWN,https://www.walmart.com/ip/Sunglasses-Columbia-C-540-S-PEAKBAGGER-244-TORTOISE-BROWN/247214851,145.06,,0,,,Clothing
Columbia C101S CLIFF HAVEN 203 Walnut Brown Rectangle Sunglasses,https://www.walmart.com/ip/Columbia-C101S-CLIFF-HAVEN-203-Walnut-Brown-Rectangle-Sunglasses/538930390,48.53,,0,,,Clothing
Columbia C107S PINE NEEDLE-200 Sunglasses,https://www.walmart.com/ip/Columbia-C107S-PINE-NEEDLE-200-Sunglasses/329994468,86.88,,0,,,Clothing
columbia saturday trail ii knee pant,https://www.walmart.com/ip/COACH-Smooth-Leather-Skinny-Wallet-Red-Apple-Gunmetal/557966173,85.00,,0,,,Clothing
Columbia Women's Cabled Cutie Beanie,https://www.walmart.com/ip/Columbia-Women-s-Cabled-Cutie-Beanie/192253597,63.72,,0,,,Clothing
Havaianas Top Logo Metallic Flip Flops White,https://www.walmart.com/ip/Volcom-Kids-Frickin-Chino-Shorts-Big-Kids-Service-Blue/590192968,43.00,4.6,22,,,Clothing
Lacoste Menerva Elite 319 1 US White/White,https://www.walmart.com/ip/Lilly-Pulitzer-Kristen-Dress-Multi-All-Together-Now/803205364,28.00,,0,,,Clothing
"Florsheim Kids Supacush Plain Toe Ox, Jr. (Toddler/Little Kid/Big Kid) White Suede/Brick Sole",https://www.walmart.com/ip/Publish-Buy-Button-Up-Shirt-Green/768378766,104.00,4.8,532,,,Clothing
Cole Haan Men Original Grand Shortwing Oxfords,https://www.walmart.com/ip/Bandolino-Cait-3-Nude/354939902?variantFieldId=actual_color,20.98,4.8,4,,,Clothing
DC Vandium White,https://www.walmart.com/ip/Hard-Tail-Overlap-Joggers-Cappuccino/454345160,68.00,4.4,192,"Bring a street-ready look to your sessions with the DC Vandium skate shoes.Sporty sneaker in a retro-trainer silhouette. Uppers of durable leather, suede, and breathable textile materials. Mesh lining for breathable comfort.OrthoLite footbed provides cushioning for all-day comfort.UniLite midsole for lightweight support. Impact-A technology features a polyurethane airbag to provide optimal cushioning and impact protection. Dynamic Grip Technology rubber outsole with three different rubber durometers for grippy, durable wear.Imported. Product measurements were taken using size 8, width B - Medium. Please note that measurements may vary by size.Weight of footwear is based on a single item, not a pair.Measurements: Weight: 11 ozDC Vandium White",,
Vans Old Skool (Gingham) Black/True White,https://www.walmart.com/ip/Stride-Rite-SR-Katie-Toddler-Aqua/440365764?variantFieldId=actual_color,500.00,,0,"It's old school or no school with the classic SoCal vibes of the Vans Old Skool shoe!Skate shoes in an iconic, low-profile silhouette. Uppers of canvas and suede or leather.Lace-up closure (Pearl Suede colorways feature ribbon laces).Padded collar and footbed for added comfort, fit and superior shock absorption.Cotton drill lining provides excellent breathability, and extra comfort.Die-cut EVA insert for added support.Vulcanized construction: Slimmed-down profile offers a flexible feel. Gum rubber outsole with signature waffle tread provides superior grip and boardfeel.Imported. Product measurements were taken using size Men's 9, Women's 10.5, width Medium. Please note that measurements may vary by size.Weight of footwear is based on a single item, not a pair.Measurements: Weight: 1 lb 2 ozVans Old Skool (Gingham) Black/True White",,
NICE CAPS Women's 3PC Fully Lined Micro Fleece Accessory Set,https://www.walmart.com/ip/NICE-CAPS-Women-s-3PC-Fully-Lined-Micro-Fleece-Accessory-Set/147480512?variantFieldId=actual_color,17.99,,0,,,Clothing
NICE CAPS Little Boys and Infants Magic Stretch Mittens 3 Pairs Assortment,https://www.walmart.com/ip/NICE-CAPS-Little-Boys-and-Infants-Magic-Stretch-Mittens-3-Pairs-Assortment/879810866,12.99,,0,,,Clothing
NICE CAPS Womens Crocheted Chenille 3 Piece Hat/Scarf/Glove Winter Headwear Accessory Cold Weather Set With Warm Fleece Lining,https://www.walmart.com/ip/NICE-CAPS-Womens-Crocheted-Chenille-3-Piece-Hat-Scarf-Glove-Winter-Headwear-Accessory-Cold-Weather-Set-With-Warm-Fleece-Lining/125429601?variantFieldId=actual_color,14.99,3.5,4,,,Clothing
Florsheim Getaway Fisherman Sandal Brown,https://www.walmart.com/ip/Florsheim-Getaway-Fisherman-Sandal-Brown/108170586?variantFieldId=actual_color,115.00,4.2,108,,,Clothing
Stride Rite SR Emerson (Toddler) Brown,https://www.walmart.com/ip/Women-s-SoftWalk-Helena-Ankle-Boot/855461154?variantFieldId=actual_color,77.00,4.2,120,,,Clothing
etnies Jameson 2 Eco Brown/Tan/Brown,https://www.walmart.com/ip/Sam-Edelman-Hazel-Baltic-Navy-Suede-Leather/451555873,59.95,4.3,71,"You don't need tricked out kicks to skate with the best. Keep it simple with the slimmed down style of the Jameson 2 from etnies.Made with eco-friendly recycled materials.Durable canvas uppers.etnies logo embroidery on tongue, with additional details on back heel and foxing.Thinly padded tongue and collar for added comfort.STI Foam Lite level 1 footbed combats the abuse feet take while skating. Textile fabric lining for moisture-wicking comfort.Internal EVA midsole for added cushioning and support.Cupsole construction for added durability.Durable 400 NBS rubber outsole.Product measurements were taken using size 8, width D - Medium. Please note that measurements may vary by size.Weight of footwear is based on a single item, not a pair.Measurements: Weight: 13 ozetnies Jameson 2 Eco Brown/Tan/Brown",,
pediped Logan Flex (Toddler/Little Kid/Big Kid) Chesnut,https://www.walmart.com/ip/American-Rose-Danica-Short-Sleeve-Pocketed-Dress-Carbon/297652663,65.00,4.5,20,,,Clothing
Men's Dunham Royalton Chukka,https://www.walmart.com/ip/Publish-Buy-Button-Up-Shirt-Green/355525961,49.95,4.8,532,,,Clothing
Allen Edmonds Super Sport Brown,https://www.walmart.com/ip/Lilly-Pulitzer-Kristen-Dress-Multi-All-Together-Now/778827499,384.00,,0,"Tailored, sophisticated, and luxurious!Premium leather upper in a handsewn construction. Technogel insole for premium shock absorption.Moc toe stitching at the toe.Easy slip-on design.Smooth leather lining for added comfort.Designed to be worn with no-show socks or barefoot.Graduated heel at a 2 angle to support your natural standing posture.Built on the 722 Last.Leather outsole with rubber pod for additional durability.Imported.Product measurements were taken using size 11.5, width D (M). Please note that measurements may vary by size.Weight of footwear is based on a single item, not a pair.Measurements: Weight: 15 ozAllen Edmonds Super Sport Brown",,
Allen Edmonds Strandmok Brown Tumbled,https://www.walmart.com/ip/Volcom-Kids-Frickin-Chino-Shorts-Big-Kids-Service-Blue/771830971,43.00,4.6,22,,,Clothing
Trotters Estee Brown Croco,https://www.walmart.com/ip/Herschel-Supply-Co-Kids-Heritage-XL-Youth-Aster-Purple-Saddle-Brown/121659473?variantFieldId=actual_color,55.30,4.5,6,,,Clothing
Wolford Individual 10 Tights Soft Sable,https://www.walmart.com/ip/Wolford-Individual-10-Tights-Soft-Sable/705843073,95.00,,0,,,Clothing
"Columbia  Men's  RFID Security Blocking Slim Front, Merino Brown, Size One Size",https://www.walmart.com/ip/Columbia-Men-s-RFID-Security-Blocking-Slim-Front-Merino-Brown-Size-One-Size/523010585,32.35,,0,,,Clothing
Josef Seibel Rosalie 27 Brandy,https://www.walmart.com/ip/Stride-Rite-SR-Katie-Toddler-Aqua/684730621?variantFieldId=actual_color,47.95,,0,,,Clothing
Zanerobe Sureshot Shorts Tan,https://www.walmart.com/ip/Bandolino-Cait-3-Nude/364042003?variantFieldId=actual_color,20.98,,0,,,Clothing
Florsheim Astor Wing Tip Oxford Cognac Smooth/Brown Sole,https://www.walmart.com/ip/Nike-Swim-Women-s-Sport-Mesh-Short-Sleeve-Hydroguard-Sapphire-XLarge-Purple/799671030,56.04,,0,"Crafted from smooth leather or soft suede, the Florsheim Astor Wing TipOxford combines a classic upper with a modern wedge sole.Oxford features alace-up closure with perforated and stitch detail for added appeal.Breathable,moisture-wicking Suedetec lining with a fully cushioned, removable Comfortechfootbed with Memory Foam for all-day comfort.Lightweight and durable EVAoutsole.Imported.Product measurements were taken using size 9, width M (D).Please note that measurements may vary by size.Weight of footwear is based ona single item, not a pair.Measurements: * Weight: 13 ozFlorsheim Astor Wing Tip Oxford Cognac Smooth/Brown Sole",,
NICE CAPS Womens Ladies Fleece Lined Cable Knit 3 Piece Hat/Scarf/Glove Winter Cold Weather Headwear Accessory Set With Metallic Specks - For Adults,https://www.walmart.com/ip/NICE-CAPS-Womens-Ladies-Fleece-Lined-Cable-Knit-3-Piece-Hat-Scarf-Glove-Winter-Cold-Weather-Headwear-Accessory-Set-With-Metallic-Specks-For-Adults/108375776,15.99,4.3,4,,,Clothing
Columbia Flex ROC Pants Flax,https://www.walmart.com/ip/Natori-Devotion-Contour-Underwire-Bra-722179-Deep-Purple-Mulberry-Purple/426323623,70.00,4.8,533,,,Clothing
Schutz Felisa Natural/Honey Beige Snake,https://www.walmart.com/ip/Skechers-Stamina-Cutback-Men-s-Shoes-Taupe-Black/497331373,40.00,4.7,1038,,,Clothing
Billabong Furocious Sandals Tan,https://www.walmart.com/ip/UGG-Jane-Patent-Jasmine/281225553,79.90,4.6,10,,,Clothing
Volcom Go Go Wrap Oatmeal,https://www.walmart.com/ip/Herschel-Supply-Co-Kids-Heritage-XL-Youth-Aster-Purple-Saddle-Brown/993951755?variantFieldId=actual_color,55.30,4.5,6,"Exude style and live in comfort with the Go Go Wrap. Knit cardigan features soft, textured fabrication in a drape silhouette for a flattering fit. Yarn-dyed stripe print. Open front with a waterfall design. Long sleeves. Asymmetrical hemline. Embroidered logo hit at nape. 65% polyester, 32% cotton, 3% elastane.Machine wash, tumble dry. Imported. Product measurements were taken using size SM. Please note that measurements may vary by size.Measurements: Length: 34 in",,
Columbia Men's Hazen Sunglasses,https://www.walmart.com/ip/Columbia-Men-s-Hazen-Sunglasses/161550447,138.12,,0,,,Clothing
Columbia Outdoor Elements Stretch Pants Tusk,https://www.walmart.com/ip/Florsheim-Getaway-Fisherman-Sandal-Brown/275153607?variantFieldId=actual_color,53.96,4.2,108,,,Clothing
Sam Edelman Hazel Champagne Rose Soft Metallic Sheep Leather,https://www.walmart.com/ip/Sam-Edelman-Hazel-Baltic-Navy-Suede-Leather/599788361,75.00,4.3,71,,,Clothing
