title,url,price,avg_review,num_reviews,desc_text,desc_list,prod_category
Laptop Case Sleeve Bag Case Compatible 11 - 15.6 Inch for Macbook AIR PRO Retina for iPad Notebook Bag,https://www.walmart.com/ip/Laptop-Case-Sleeve-Bag-Case-Compatible-11-15-6-Inch-for-Macbook-AIR-PRO-Retina-for-iPad-Notebook-Bag/337068122?variantFieldId=actual_color,8.99,5.0,1,"kse:widget data-widget-type=""""relatedProduct"""" id=""""22973353"""" title=""""Notebook"" type=""""relation""""> ","Wear-resisting, Lighter and Earthquake Resistant, Breathable, Anti-static.,Durable and lightweight, this case is great to take with you on the go, even with your slim favorite case.,Add a touch of style and individuality to your device with this colorful case.,Heavy-duty custom zipper pulls with closed-seam construction.",Electronics
For MacBook 13.3” Laptop Sleeve Case Carry Bag Universal Laptop Bag For MacBook Samsung Chromebook HP Acer Lenovo,https://www.walmart.com/ip/For-MacBook-13-3-Laptop-Sleeve-Case-Carry-Bag-Universal-Laptop-Bag-For-MacBook-Samsung-Chromebook-HP-Acer-Lenovo/893493009,11.39,2.0,1,"【Compatible with】: This laptop exterior size 34.5x25.5cm/13.6x10in, compatible with MacBook Air 13.3”: A2179/A1932/A1466, MacBook Pro 13.3”: A1706/A1708/A1989/A2159/A1425/A1502/A1278. Also compatible with other laptop display size up to 13.5” like: Surface Book, Dell, Samsung, HP, Acer, ASUS, Lenovo, Toshiba, Sony.","【Compatible with】: This laptop exterior size 34.5x25.5cm/13.6x10in, compatible with MacBook Air 13.3”: A2179/A1932/A1466, MacBook Pro 13.3”: A1706/A1708/A1989/A2159/A1425/A1502/A1278. Also compatible with other laptop display size up to 13.5” like: Surface Book, Dell, Samsung, HP, Acer, ASUS, Lenovo, Toshiba, Sony.,【Ultimate Protection & Laptop Sleeve Cover】: Your most valued laptop/MacBook deserves no less than the ultimate protection from scratching, scuffing, and dents, a top-quality guarantee provided by the latest in state-of-the-art product line.,【High Grade Neoprene】: Made from excellent-quality neoprene, this sleeve is precision engineered to provide maximum protection for your precious laptop while allowing a snug fit without adding any extra bulk.,【Multi-Function】: More than just your ideal Apple Sleeve for your MacBook, this innovation comes with 2 zippered smart pockets for organization and easy access to your charger, phone, mouse and other accessories.,【Premium Quality Sleeve Bag】: Manufactured from the finest and highest-quality materials to ensure durability, specially designed with cushioned inner lining, tailored to fit your MacBook and ensure maximum grip, based on and passed international quality standards",Electronics
Reverse Folding Double Layer Inverted Chuva Umbrella Self Stand Inside Out Rain Protection C-Hook Hands Windproof for Car,https://www.walmart.com/ip/Reverse-Folding-Double-Layer-Inverted-Chuva-Umbrella-Self-Stand-Inside-Out-Rain-Protection-C-Hook-Hands-Windproof-for-Car/372513273,35.03,,0,,,Clothing
"Multifunctional cushion with memory foam, double O-shaped hollow design, hip elevation, pillow cushion, home office pillow",https://www.walmart.com/ip/Multifunctional-cushion-with-memory-foam-double-O-shaped-hollow-design-hip-elevation-pillow-cushion-home-office-pillow/542897356?variantFieldId=actual_color,16.99,,0,,,Clothing
1pcs Dog Training Clickers 2 in 1 Whistle and Clicker Pet Training Tools with Wrist Strap Key Ring for Dogs Cats Pets,https://www.walmart.com/ip/1pcs-Dog-Training-Clickers-2-in-1-Whistle-and-Clicker-Pet-Training-Tools-with-Wrist-Strap-Key-Ring-for-Dogs-Cats-Pets/424149068?variantFieldId=actual_color,7.29,,0,Product Description:,"The size of the product is small and easy to carry.,The project includes a clicker and a whistle. This two-in-one design is economical and practical, and can meet different needs at the same time.,There are several different colors for you to choose from, they are bright and beautiful, and can show your fashion taste.,We guarantee it is 100% new. The product uses high-quality materials, durable and economical.,Clicker trainer and whistle can help you train pets in a simple way.",Pets
Stylish PU Leather Long Wallet women Wallet Leisure Purse Simple Women Wallets Long Coin Pocket Card Holder Purse Fashion,https://www.walmart.com/ip/Stylish-PU-Leather-Long-Wallet-women-Wallet-Leisure-Purse-Simple-Women-Wallets-Long-Coin-Pocket-Card-Holder-Purse-Fashion/356350750?variantFieldId=actual_color,9.99,,0,,,Clothing
"1PC Car Silicone Keychain, With Cute Bulldogs Pendant Rope For Key Holder Female Gift Key Chain",https://www.walmart.com/ip/1PC-Car-Silicone-Keychain-With-Cute-Bulldogs-Pendant-Rope-For-Key-Holder-Female-Gift-Key-Chain/179202501?variantFieldId=actual_color,8.29,,0,,,Clothing
Baby Cloth Diapers One Size Adjustable Washable Reusable for Baby Girls and Boys,https://www.walmart.com/ip/Baby-Cloth-Diapers-One-Size-Adjustable-Washable-Reusable-for-Baby-Girls-and-Boys/260941495?variantFieldId=actual_color,8.09,,0,100% Brand New and High Quality. ,"One size fits all,suitable for baby weight from 10lbs to 36lbs,Features durable snaps and a layer of PUL (waterproof material),Machine wash warm, tumble dry low or hang to dry; No bleach, additives or softeners",Baby
3D Egg Shell Cartoon Waterproof Shoulder PU Girls Backpacks Primary School Elementary For Children,https://www.walmart.com/ip/3D-Egg-Shell-Cartoon-Waterproof-Shoulder-PU-Girls-Backpacks-Primary-School-Elementary-For-Children/742629914,41.39,,0,,,Clothing
2020 Fashion Hot Sales Teenage Casual Canvas Cute Lightweight Backpack Bag Set for Girls,https://www.walmart.com/ip/2020-Fashion-Hot-Sales-Teenage-Casual-Canvas-Cute-Lightweight-Backpack-Bag-Set-for-Girls/612867048,51.29,,0,,,Clothing
Casual Hot Sales Girls Baby Kids Boy Travel Backpack Cartoon Small Shoulder School Bag,https://www.walmart.com/ip/Casual-Hot-Sales-Girls-Baby-Kids-Boy-Travel-Backpack-Cartoon-Small-Shoulder-School-Bag/652071028,26.99,,0,,,Clothing
UPF 50+ UV Sun Protection Wide Brim Baby Sun Hat,https://www.walmart.com/ip/UPF-50-UV-Sun-Protection-Wide-Brim-Baby-Sun-Hat/346952318,12.59,,0,,,Clothing
Children Girls Rabbit Ear Sequins Backpack Casual Small Kawaii Cartoon Kids School PU Leather Shoulder Bags,https://www.walmart.com/ip/Children-Girls-Rabbit-Ear-Sequins-Backpack-Casual-Small-Kawaii-Cartoon-Kids-School-PU-Leather-Shoulder-Bags/355661593,15.29,,0,,,Clothing
Popvcly Zipper Laptop Sleeve Case Bag For Macbook iPad Notebook Pink 12 inch,https://www.walmart.com/ip/Popvcly-Zipper-Laptop-Sleeve-Case-Bag-For-Macbook-iPad-Notebook-Black-15-inch/744799406,10.99,,0,"Material: Cotton,Polyester","Wear-resisting, Lighter and Earthquake Resistant, Breathable, Anti-static,Durable and lightweight, this case is great to take with you on the go, even with your slim favorite case,Add a touch of style and individuality to your device with this colorful case,Heavy-duty custom zipper pulls with closed-seam construction,Size:11 inch, 12 inch, 13 inch, 14 inch, 15 inch, 15.6 inch",Electronics
"Zipper Laptop Sleeve Case Laptop Bags For Macbook AIR PRO Retina 12-inch 14"" 15"" Portable",https://www.walmart.com/ip/Zipper-Laptop-Sleeve-Case-Laptop-Bags-For-Macbook-AIR-PRO-Retina-12-inch-14-15-Portable/626992359?variantFieldId=actual_color,8.67,,0,Product Description: ,"New Band and High Quality.,Wear-resisting, Lighter and Earthquake Resistant, Breathable, Anti-static.,Durable and lightweight, this case is great to take with you on the go, even with your slim favorite case.,Add a touch of style and individuality to your device with this colorful case.,Heavy-duty custom zipper pulls with closed-seam construction.",Electronics
3 Pcs Cartoon Travel Portable Storage Bags Waterproof Organizer Clothes Case With Zipper,https://www.walmart.com/ip/3-Pcs-Cartoon-Travel-Portable-Storage-Bags-Waterproof-Organizer-Clothes-Case-With-Zipper/339460119?variantFieldId=actual_color,7.29,,0,,,Clothing
Popvcly Ultra Light Mini Pocket Umbrella Sun Sunshade UV Protection Umbrella Five Folding Umbrella Dual-use Sunny Rain Pink,https://www.walmart.com/ip/Popvcly-Ultra-Light-Mini-Pocket-Umbrella-Sun-Sunshade-UV-Protection-Umbrella-Five-Folding-Umbrella-Dual-use-Sunny-Rain-Black/975835214?variantFieldId=actual_color,14.45,,0,,,Clothing
"Popvcly Reusable Cloth Face Bandanas Set, Cotton, Back To School/Work Supplies",https://www.walmart.com/ip/Popvcly-Reusable-Cloth-Face-Bandanas-Set-Cotton-Back-To-School-Work-Supplies/297003361?variantFieldId=actual_color,8.99,,0,,,Clothing
Cycling Face Mask Balaclava Women Men Outdoor Sport Sunshade Dust-proof Windproof Quick Dry Anti UV Breathable Motorcycle Riding Skiing Cap Headwear,https://www.walmart.com/ip/Cycling-Face-Mask-Balaclava-Women-Men-Outdoor-Sport-Sunshade-Dust-proof-Windproof-Quick-Dry-Anti-UV-Breathable-Motorcycle-Riding-Skiing-Cap-Headwear/488067626,8.79,,0,,,Clothing
Cycling Face Mask Balaclava Women Men Outdoor Sport Sunshade Dust-proof Windproof Quick Dry Anti UV Breathable Motorcycle Riding Skiing Cap Headwear,https://www.walmart.com/ip/Cycling-Face-Mask-Balaclava-Women-Men-Outdoor-Sport-Sunshade-Dust-proof-Windproof-Quick-Dry-Anti-UV-Breathable-Motorcycle-Riding-Skiing-Cap-Headwear/184764173,8.29,,0,,,Clothing
Popvcly Women's Knit Cardigan Thin and Versatile Long-sleeved Bottoming Shirt Pink,https://www.walmart.com/ip/Popvcly-Women-s-Knit-Cardigan-Thin-and-Versatile-Long-sleeved-Bottoming-Shirt-Black/372912034?variantFieldId=actual_color,12.05,,0,,,Clothing
"Popvcly Reusable Cloth Face Bandanas Set, Cotton, Back To School/Work Supplies",https://www.walmart.com/ip/Popvcly-Reusable-Cloth-Face-Bandanas-Set-Cotton-Back-To-School-Work-Supplies/318859981?variantFieldId=actual_color,8.99,,0,,,Clothing
Sun Cap UV Protection Removable Neck & Face Flap Cover Caps for Summer Outdoor Hiking Fishing Gardening Hunting Camping,https://www.walmart.com/ip/Sun-Cap-UV-Protection-Removable-Neck-Face-Flap-Cover-Caps-for-Summer-Outdoor-Hiking-Fishing-Gardening-Hunting-Camping/678328467?variantFieldId=actual_color,9.19,,0,,,Clothing
Cycling Bandana Skull Cap Beanie Lightweight Adjustable Cotton Biker Hat Hood Headband Headscarf Doo Rags Head Wraps Costume,https://www.walmart.com/ip/Cycling-Bandana-Skull-Cap-Beanie-Lightweight-Adjustable-Cotton-Biker-Hat-Hood-Headband-Headscarf-Doo-Rags-Head-Wraps-Costume/904873337,7.00,,0,,,Clothing
Lightweight Adjustable Cotton Biker Skull Cap Motorcycle Bandana Head Wrap Du Doo Rag Cool Rags Costume,https://www.walmart.com/ip/Lightweight-Adjustable-Cotton-Biker-Skull-Cap-Motorcycle-Bandana-Head-Wrap-Du-Doo-Rag-Cool-Rags-Costume/933319279?variantFieldId=actual_color,6.39,,0,,,Clothing
Newest 600D Military Tactical Life Bag Multifunctional Tool Pouch EDC Springs Hinge Hunting Durable Belt Pouches Packs Outdoor,https://www.walmart.com/ip/Newest-600D-Military-Tactical-Life-Bag-Multifunctional-Tool-Pouch-EDC-Springs-Hinge-Hunting-Durable-Belt-Pouches-Packs-Outdoor/816022384?variantFieldId=actual_color,8.99,,0,,,Clothing
"Outdoor Sports Tactics Two Way Radio Walkie Talkie Nylon Portable Waterproof Durable Pouch Case Holder,Green",https://www.walmart.com/ip/Outdoor-Sports-Tactics-Two-Way-Radio-Walkie-Talkie-Nylon-Portable-Waterproof-Durable-Pouch-Case-Holder-Camouflage/292943194,8.18,,0,Feature:,"1.Made of nylon, this waist pouch is durable and uneasy to get dust on it,2.On the back of this pouch are 2 straps with buttons, allowing you to pass through your waist belt easily,3.Once you put your walkie talkie inside the waist bag, you could insert the buckled strap and then it is done. Easy and convenient,4.The whole waist pouch has the holes for you to connect the plugs and access the volume knob without taking out the tool itself,5.This portable waist pouch fits for two way radio",Electronics
"Multi-functional Large Capacity Waterproof Baby Diaper Backpack Maternity,Dark Green",https://www.walmart.com/ip/Multi-functional-Large-Capacity-Waterproof-Baby-Diaper-Backpack-Maternity-Orange/376251226,79.99,,0,Features:,"Stylish baby diaper bag made of durable and water resistant polyester fabric, used to keep baby care ,clothes and other essentials perfect in light rain or snow day,Top of bag is wired with metal so that bag can be set to stay open hands-free, but folds closed easily for efficient carrying and storage,Large-capacity, multi-functional backpack/diaper bag is durably-crafted and works equally well for travel and everyday use,Outer material is made of waterproof polyester, while the inside features a waterproof polyester lining. Comfortable, lightweight, fashionable, and waterproof,Multi-function Baby Bag with Smart Organizer System",Baby
"Tactical 600D Outdoor Durable Belt Waist Bag Multi tool Molle Pouch Tool Zipper Pouch,Green",https://www.walmart.com/ip/Tactical-600D-Outdoor-Durable-Belt-Waist-Bag-Multi-tool-Molle-Pouch-Tool-Zipper-Pouch-Khaki/690625708,13.49,,0,,,Clothing
"Laptop Case, 15.4” PU Leather Laptop Sleeve Case With Stand Function For MacBook Samsung Chromebook HP Acer Lenovo",https://www.walmart.com/ip/Laptop-Case-15-4-PU-Leather-Laptop-Sleeve-Case-With-Stand-Function-For-MacBook-Samsung-Chromebook-HP-Acer-Lenovo/723408424?variantFieldId=actual_color,15.99,,0,Description:,"【Compatible Equipment】Only Compatible with 15.4” inch MacBook Pro (Model: A1707/A1990/A1398/A1286) Laptop. Please make sure your EQUIPMENT MODEL before ordering!,【Dimension】38.5x27.5cm/15.2x10.8in. Weight: 0.62lb / 280g. PACKAGE INCLUDES: 1 PCS PU SLEEVE CASE, others are for illustration and are not included.,【Multi-function Design】It can be used as an common laptop case or as a laptop stand. You can use the protection cover bracket function to adjust the angle of the laptop, making your working, reading or browsing video more comfortable.,【Ultra-Thin】Easy to carry or put in other bags, perfect for work, travel and daily use. Magnetic snaps design protects your MacBook from sliding out of the bag, making it convenient for you to store and take out your laptop.,【Made of Premium Durable PU】Synthetic Leather to make it soft touch and good heat dissipation performance. Durable and Scratch-resistant design to protect your laptop from scratches, dirt, accidental impact, and more.",Electronics
3 Pcs Cartoon Travel Portable Storage Bags Waterproof Organizer Clothes Case With Zipper,https://www.walmart.com/ip/3-Pcs-Cartoon-Travel-Portable-Storage-Bags-Waterproof-Organizer-Clothes-Case-With-Zipper/829056895?variantFieldId=actual_color,7.29,,0,,,Clothing
Half Finger Flip Gloves Women Coral Velvet Cold-Proof Mittens Unisex Winter Warm Soft Dual-Purpose Fleece Glove Female,https://www.walmart.com/ip/Half-Finger-Flip-Gloves-Women-Coral-Velvet-Cold-Proof-Mittens-Unisex-Winter-Warm-Soft-Dual-Purpose-Fleece-Glove-Female/249001208?variantFieldId=actual_color,6.84,,0,,,Clothing
"Color Heat Insulation Water Absorption Antiskid Felt Coaster,Gray",https://www.walmart.com/ip/Color-Heat-Insulation-Water-Absorption-Antiskid-Felt-Coaster-Yellow/293860472,7.19,,0,,,Clothing
Fashion Women'S Faux Rabbit Fur Hand Wrist Warmer Half Finger Gloves Winter Glove,https://www.walmart.com/ip/Fashion-Women-S-Faux-Rabbit-Fur-Hand-Wrist-Warmer-Half-Finger-Gloves-Winter-Glove/367415780?variantFieldId=actual_color,10.04,,0,,,Clothing
"Quality Mini Pocket Umbrella, Women Sunny and Rainy Mini Fashion Folding Umbrellas, Small Sun Parasol Umbrella Rain",https://www.walmart.com/ip/Quality-Mini-Pocket-Umbrella-Women-Sunny-and-Rainy-Mini-Fashion-Folding-Umbrellas-Small-Sun-Parasol-Umbrella-Rain/804453342,11.09,,0,,,Clothing
4 Colors Inflatable Neck Pillow Comfortable Pillows U Form Cushion Journey From Aircraft Travel Accessories For Sleep,https://www.walmart.com/ip/4-Colors-Inflatable-Neck-Pillow-Comfortable-Pillows-U-Form-Cushion-Journey-From-Aircraft-Travel-Accessories-For-Sleep/418114810,7.39,,0,,,Clothing
Laptop Pillow Foam Lapdesk Multifunctional Cooling Pad Tablet Stand Holder Lap Rest Cushion For IPad With Bag,https://www.walmart.com/ip/Laptop-Pillow-Foam-Lapdesk-Multifunctional-Cooling-Pad-Tablet-Stand-Holder-Lap-Rest-Cushion-For-IPad-With-Bag/105656652?variantFieldId=actual_color,16.87,,0,Feature:,"Premium MATERIAL---Made of linen and cotton, soft body pillow offers comfortable extended use of your device for iPad, eBook reader, and tablet computer.,Ideal for iPad, eBook reader, tablet, books, and magazines.,Considerate design---Small pockets on both sides for easy storage of accessories such as headphones, stylus pen, charging cable, etc.,Multi-purpose---Enjoy your favorite reading, movies, media or simply browsing the web from the comfort of your bed, sofa, or armchair with this pillow holder for iPad.,Easy to use---Just place your devices on the stand, move from the kitchen table to your desk, chair, bed or even to the car for comfortable entertainment on the go.",Office Supplies
For MacBook 13.3” Laptop Sleeve Case Carry Bag Universal Laptop Bag For MacBook Samsung Chromebook HP Acer Lenovo,https://www.walmart.com/ip/For-MacBook-13-3-Laptop-Sleeve-Case-Carry-Bag-Universal-Laptop-Bag-For-MacBook-Samsung-Chromebook-HP-Acer-Lenovo/956817916,11.39,,0,"【Compatible with】: This laptop exterior size 34.5x25.5cm/13.6x10in, compatible with MacBook Air 13.3”: A2179/A1932/A1466, MacBook Pro 13.3”: A1706/A1708/A1989/A2159/A1425/A1502/A1278. Also compatible with other laptop display size up to 13.5” like: Surface Book, Dell, Samsung, HP, Acer, ASUS, Lenovo, Toshiba, Sony.","【Compatible with】: This laptop exterior size 34.5x25.5cm/13.6x10in, compatible with MacBook Air 13.3”: A2179/A1932/A1466, MacBook Pro 13.3”: A1706/A1708/A1989/A2159/A1425/A1502/A1278. Also compatible with other laptop display size up to 13.5” like: Surface Book, Dell, Samsung, HP, Acer, ASUS, Lenovo, Toshiba, Sony.,【Ultimate Protection & Laptop Sleeve Cover】: Your most valued laptop/MacBook deserves no less than the ultimate protection from scratching, scuffing, and dents, a top-quality guarantee provided by the latest in state-of-the-art product line.,【High Grade Neoprene】: Made of high quality waterproof nylon and soft fluffy flannel padding lining, enable to protect your Laptop Case from impact, suddenly drop, scratch, dust, oil and etc.,【Multi-Function】: More than just your ideal Apple Sleeve for your MacBook, this innovation comes with a zippered smart pocket for organization and easy access to your charger, phone, mouse and other accessories.,【Premium Quality Sleeve Bag】: Manufactured from the finest and highest-quality materials to ensure durability, specially designed with cushioned inner lining, tailored to fit your MacBook and ensure maximum grip, based on and passed international quality standards",Electronics
"Laptop Case, 12” 11.6” PU Leather Laptop Sleeve Case With Stand Function For MacBook Samsung Chromebook HP Acer Lenovo",https://www.walmart.com/ip/Laptop-Case-12-11-6-PU-Leather-Laptop-Sleeve-Case-With-Stand-Function-For-MacBook-Samsung-Chromebook-HP-Acer-Lenovo/108202018?variantFieldId=actual_color,14.59,,0,Description:,"【Compatible Equipment】Only Compatible with 12”/11.6” inch MacBook(Model: A1534/A1465/A1370) Laptop. Please make sure your EQUIPMENT MODEL before ordering!,【Dimension】12.8x8.5in / 32.5x21.5cm. Weight: 0.485lb / 220g. PACKAGE INCLUDES: 1 PCS PU SLEEVE CASE, others are for illustration and are not included.,【Multi-function Design】It can be used as an common laptop case or as a laptop stand. You can use the protection cover bracket function to adjust the angle of the laptop, making your working, reading or browsing video more comfortable.,【Ultra-Thin】Easy to carry or put in other bags, perfect for work, travel and daily use. Magnetic snaps design protects your MacBook from sliding out of the bag, making it convenient for you to store and take out your laptop.,【Made of Premium Durable PU】Synthetic Leather to make it soft touch and good heat dissipation performance. Durable and Scratch-resistant design to protect your laptop from scratches, dirt, accidental impact, and more.",Electronics
"Mini Pocket Travel Umbrella with Case - Small, Umbrella for Backpacks, Unisex Design - Made with Water-Resistant Pongee Fabric",https://www.walmart.com/ip/Mini-Pocket-Travel-Umbrella-with-Case-Small-Umbrella-for-Backpacks-Unisex-Design-Made-with-Water-Resistant-Pongee-Fabric/651721590?variantFieldId=actual_color,12.88,,0,,,Clothing
Laptop Pillow Foam Lapdesk Multifunctional Cooling Pad Tablet Stand Holder Lap Rest Cushion For IPad With Bag,https://www.walmart.com/ip/Laptop-Pillow-Foam-Lapdesk-Multifunctional-Cooling-Pad-Tablet-Stand-Holder-Lap-Rest-Cushion-For-IPad-With-Bag/360576211,16.59,,0,Feature:,"Premium MATERIAL---Made of linen and cotton, soft body pillow offers comfortable extended use of your device for iPad, eBook reader, and tablet computer.,Lightweight but sturdy enough to place your devices.,Ideal for iPad, eBook reader, tablet, books, and magazines.,Considerate design---Small pockets on both sides for easy storage of accessories such as headphones, stylus pen, charging cable, etc.,Multi-purpose---Enjoy your favorite reading, movies, media or simply browsing the web from the comfort of your bed, sofa, or armchair with this pillow holder for iPad.",Office Supplies
Tactical 600D Outdoor Waist Bag Multitool Molle Pouch Tool Zipper Waist Pack Hungitng Accessory Durable Belt Pouch,https://www.walmart.com/ip/Tactical-600D-Outdoor-Waist-Bag-Multitool-Molle-Pouch-Tool-Zipper-Waist-Pack-Hungitng-Accessory-Durable-Belt-Pouch/481281985?variantFieldId=actual_color,9.59,,0,,,Clothing
7 Strands Outdoor Survival Paracord Bracelet Steel Ball Corrosion Resistant Anti-aging Wrist Strap Wristband Key Chain Tool Camping Adventure Accessories,https://www.walmart.com/ip/7-Strands-Outdoor-Survival-Paracord-Bracelet-Steel-Ball-Corrosion-Resistant-Anti-aging-Wrist-Strap-Wristband-Key-Chain-Tool-Camping-Adventure-Accesso/629185598?variantFieldId=actual_color,9.79,,0,,,Clothing
Chest Rig Waist Bag Hip Hop Streetwear Functional Tactical Chest Bag Cross Shoulder Bag Radio Harness Chest Front Pack,https://www.walmart.com/ip/Chest-Rig-Waist-Bag-Hip-Hop-Streetwear-Functional-Tactical-Chest-Bag-Cross-Shoulder-Bag-Radio-Harness-Chest-Front-Pack/626657036?variantFieldId=actual_color,14.59,,0,,,Clothing
Laptop Pillow Foam Lap desk Multifunctional Cooling Pad Tablet Stand Holder Lap Rest Cushion For iPad Tablet With Bag,https://www.walmart.com/ip/Laptop-Pillow-Foam-Lap-desk-Multifunctional-Cooling-Pad-Tablet-Stand-Holder-Lap-Rest-Cushion-For-iPad-Tablet-With-Bag/435042796?variantFieldId=actual_color,19.99,,0,Laptop Pillow Foam Lap desk Multifunctional Cooling Pad Tablet Stand Holder Lap Rest Cushion For iPad Tablet With Bag ,"1.Premium MATERIAL---Made of linen and cotton, soft body pillow offers comfortable extended use of your device for iPad, eBook reader, and tablet computer. Lightweight but sturdy enough to place your devices.,2.Ideal for iPad, eBook reader, tablet, books, and magazines.,3.Considerate design---Small pockets on both sides for easy storage of accessories such as headphones, stylus pen, charging cable, etc.,4.Multi-purpose---Enjoy your favorite reading, movies, media or simply browsing the web from the comfort of your bed, sofa, or armchair with this pillow holder for iPad.",Electronics
Diaper Bag Large Multifunctional Water Resistant Portable Outdoor Baby Nappy Tote Handbag,https://www.walmart.com/ip/Diaper-Bag-Large-Multifunctional-Water-Resistant-Portable-Outdoor-Baby-Nappy-Tote-Handbag/803255198,9.29,,0,Feature:,"This baby diaper bag is washable and reusable,It makes it convenient to collect wet baby diapers or other items,It will keep the baby's needs beautiful and orderly,The handle offers a firm and comfortable hold for you,It is a wonderful helper for people with the prams",Baby
Mini Five-folding Non-automatic Travel Umbrella Multicolor Capsule Mini Pocket Light Umbrella Women Men Travel Compact Rain Umbrella,https://www.walmart.com/ip/Mini-Five-folding-Non-automatic-Travel-Umbrella-Multicolor-Capsule-Mini-Pocket-Light-Umbrella-Women-Men-Travel-Compact-Rain-Umbrella/344847762?variantFieldId=actual_color,15.99,,0,Product Description:,"Compact Mini Umbrella - This compact umbrella comes with a beautiful gift case. Put the umbrella in the case to stop water leaking in your car, handbag, backpack, duffle bag, or briefcase etc.,Convenient and A Perfect Gift - Mini size and ultra light, this umbrella is quite convenient to tote around you anytime anywhere. Stylish look plus various bright colors for you to choose make this umbrella as a perfectly ideal gift to your family, friends and colleagues!,Non-automatic & 5 Fold Design - Without any switch button, its easy and convenient to open and close the umbrella without hurting your fingers. 5-fold design enhances the robustness, making the umbrella study for use.,6 Ribs with Aluminium Alloy Tips - 6 ribs are constructed with aluminium alloy tips, preventing the umbrella from flipping out in a rainy day. NOTE: Please put all the ribs into the handle grip after folding, then put the umbrella into the case.,Rubber Handle Grip - Providing you a soft and comfortable grip.",
Popvcly Ultra Light Mini Pocket Umbrella Sun Sunshade UV Protection Umbrella Five Folding Umbrella Dual-use Sunny Rain Gray,https://www.walmart.com/ip/Popvcly-Ultra-Light-Mini-Pocket-Umbrella-Sun-Sunshade-UV-Protection-Umbrella-Five-Folding-Umbrella-Dual-use-Sunny-Rain-Black/314434155?variantFieldId=actual_color,14.45,,0,,,Clothing
"1PC Car Silicone Keychain, With Cute Bulldogs Pendant Rope For Key Holder Female Gift Key Chain",https://www.walmart.com/ip/1PC-Car-Silicone-Keychain-With-Cute-Bulldogs-Pendant-Rope-For-Key-Holder-Female-Gift-Key-Chain/337036472?variantFieldId=actual_color,8.29,,0,,,Clothing
